{
  "$schema": "https://json-schema.org/draft/2020-12/schema",
  "$id": "https://schemas.ghostpad.invalid/ghostroom/v0/lease.schema.json",
  "title": "GHOSTroom edit lease",
  "description": "Authority to mutate Blender. Inspection needs no lease. At most one active lease per scope may overlap, and mutating jobs must carry the lease_id. GHOSTpad always knows who holds it.",
  "type": "object",
  "required": ["lease_id", "holder", "acquired_at", "expires_at", "scope", "state"],
  "additionalProperties": false,
  "properties": {
    "lease_id": { "$ref": "common.schema.json#/$defs/id" },
    "holder": {
      "description": "The user or an agent. The user can always take the lease back.",
      "$ref": "common.schema.json#/$defs/origin"
    },
    "acquired_at": { "$ref": "common.schema.json#/$defs/timestamp" },
    "expires_at": {
      "description": "Hard expiry. Holders renew before this time. An expired lease grants nothing, even if a job is still running.",
      "$ref": "common.schema.json#/$defs/timestamp"
    },
    "scope": {
      "type": "object",
      "additionalProperties": false,
      "required": ["kind", "scene_id"],
      "properties": {
        "kind": {
          "description": "scene: the whole scene. objects/collection: named datablocks only. file: save/open/revert (implies scene).",
          "enum": ["scene", "objects", "collection", "file"]
        },
        "scene_id": { "$ref": "common.schema.json#/$defs/blender_id" },
        "boot_id": { "$ref": "common.schema.json#/$defs/blender_id" },
        "targets": {
          "type": "array",
          "minItems": 1,
          "maxItems": 256,
          "uniqueItems": true,
          "items": { "type": "string", "minLength": 1, "maxLength": 256 }
        }
      },
      "allOf": [
        {
          "if": { "properties": { "kind": { "enum": ["objects", "collection"] } } },
          "then": { "required": ["targets"] }
        }
      ]
    },
    "state": { "enum": ["active", "released", "expired", "revoked"] },
    "task": { "$ref": "common.schema.json#/$defs/id" },
    "revoked_by": { "$ref": "common.schema.json#/$defs/origin" },
    "reason": { "type": "string", "maxLength": 500 }
  },
  "allOf": [
    {
      "if": { "properties": { "state": { "const": "revoked" } } },
      "then": { "required": ["revoked_by"] }
    }
  ]
}
